{
  "base_branch": "main",
  "candidate_paths": [
    "config/technical_identity_contract.json",
    "config/technical_namespace_aliases.json",
    "config/identity_compatibility_runtime.json",
    "policies/technical_namespace_migration_policy.json",
    "schemas/transformation/technical_identity_contract.schema.json",
    "docs/phase46i/README.md",
    "tools/transformation_controller/phase46i.py",
    "tests/transformation/test_phase46i_technical_identity.py"
  ],
  "commit_message": "feat(transformation): add bounded technical namespace compatibility",
  "feature_branch": "phase46i/bounded-technical-namespace-compatibility",
  "full_validation_commands": [
    {
      "argv": [
        "{python}",
        "-m",
        "ruff",
        "check",
        "."
      ],
      "name": "Ruff"
    },
    {
      "argv": [
        "{python}",
        "-m",
        "mypy",
        "."
      ],
      "name": "MyPy"
    },
    {
      "argv": [
        "{python}",
        "-m",
        "pytest",
        "-q"
      ],
      "name": "Pytest"
    }
  ],
  "implementation_commands": [
    {
      "argv": [
        "{python}",
        "-m",
        "tools.lifecycle_orchestrator.campaign_payloads",
        "provision-prerequisites",
        "--project-root",
        "{worktree}"
      ],
      "name": "Provision ignored lifecycle prerequisites"
    },
    {
      "argv": [
        "{python}",
        "-m",
        "tools.lifecycle_orchestrator.campaign_payloads",
        "install",
        "--phase",
        "46I",
        "--project-root",
        "{worktree}"
      ],
      "name": "Install 46I deterministic payload"
    }
  ],
  "llm": {
    "allowed_calls": 0,
    "enabled": false
  },
  "name": "Bounded technical namespace compatibility",
  "phase": "46I",
  "post_restore_validation_commands": [
    {
      "argv": [
        "{python}",
        "scripts/validate_phase13g_readonly_validation_guardrails.py"
      ],
      "name": "Phase 13G validation"
    },
    {
      "argv": [
        "{python}",
        "-m",
        "pytest",
        "-q",
        "tests/test_phase13g_readonly_validation_guardrails.py"
      ],
      "name": "Phase 13G tests"
    }
  ],
  "protected_actions": [
    "commit",
    "merge",
    "push"
  ],
  "runtime_noise_paths": [
    "workspace/factory_generated/upi_dispute_resolution/generation_runs/first_governed_generation_run_001/agent_runtime_ledgers/adapter_capability_ledger.jsonl",
    "workspace/factory_generated/upi_dispute_resolution/generation_runs/first_governed_generation_run_001/agent_runtime_ledgers/adapter_execution_ledger.jsonl",
    "workspace/factory_generated/upi_dispute_resolution/generation_runs/first_governed_generation_run_001/agent_runtime_ledgers/handoff_ledger.jsonl",
    "workspace/factory_generated/upi_dispute_resolution/generation_runs/first_governed_generation_run_001/agent_runtime_ledgers/runtime_event_ledger.jsonl",
    "workspace/factory_generated/upi_dispute_resolution/generation_runs/first_governed_generation_run_001/agent_runtime_ledgers/tool_execution_ledger.jsonl",
    "workspace/factory_generated/upi_dispute_resolution/lifecycle_artifacts/phase14u/autonomous_phase_discovery_and_planning_audit.json",
    "workspace/factory_generated/upi_dispute_resolution/lifecycle_artifacts/phase34/operator_portal_validation_run_report.json",
    "workspace/factory_generated/upi_dispute_resolution/lifecycle_artifacts/phase37/end_to_end_portal_run_flow_report.json"
  ],
  "schema_version": 1,
  "status": "DRAFT",
  "targeted_validation_commands": [
    {
      "argv": [
        "{python}",
        "-m",
        "tools.transformation_controller.phase46i",
        "--project-root",
        "{worktree}"
      ],
      "name": "Verify Phase 46I technical identity"
    },
    {
      "argv": [
        "{python}",
        "-m",
        "pytest",
        "-q",
        "tests/transformation/test_phase46i_technical_identity.py"
      ],
      "name": "Phase 46I tests"
    },
    {
      "argv": [
        "{python}",
        "-m",
        "ruff",
        "check",
        "tools/transformation_controller/phase46i.py",
        "tests/transformation/test_phase46i_technical_identity.py"
      ],
      "name": "Phase 46I Ruff"
    },
    {
      "argv": [
        "{python}",
        "-m",
        "mypy",
        "tools/transformation_controller/phase46i.py",
        "tests/transformation/test_phase46i_technical_identity.py"
      ],
      "name": "Phase 46I MyPy"
    }
  ]
}
