{
  "base_branch": "main",
  "candidate_paths": [
    "tools/autonomous_supervisor/clean_slate.py",
    "scripts/run_phase46n_clean_slate_replay.py",
    "config/autonomous/clean_slate_replay.json",
    "policies/clean_slate_replay_policy.json",
    "schemas/autonomous/clean_slate_replay.schema.json",
    "tests/autonomous_supervisor/test_phase46n_clean_slate_replay.py",
    "docs/phase46n/README.md"
  ],
  "commit_message": "feat(factory): add isolated clean-slate replay and handoff proof",
  "feature_branch": "phase46n/isolated-clean-slate-replay-handoff-proof",
  "full_validation_commands": [
    {
      "argv": [
        "{python}",
        "-m",
        "ruff",
        "check",
        "."
      ],
      "name": "Ruff"
    },
    {
      "argv": [
        "{python}",
        "-m",
        "mypy",
        "."
      ],
      "name": "MyPy"
    },
    {
      "argv": [
        "{python}",
        "-m",
        "pytest",
        "-q"
      ],
      "name": "Pytest"
    }
  ],
  "implementation_commands": [
    {
      "argv": [
        "{python}",
        "-m",
        "tools.autonomous_supervisor.phase_payloads",
        "install",
        "--phase",
        "46N",
        "--project-root",
        "{worktree}"
      ],
      "name": "Install 46N deterministic payload"
    }
  ],
  "llm": {
    "allowed_calls": 0,
    "enabled": false
  },
  "name": "Isolated clean-slate replay and handoff proof",
  "phase": "46N",
  "post_restore_validation_commands": [
    {
      "argv": [
        "{python}",
        "scripts/validate_phase13g_readonly_validation_guardrails.py"
      ],
      "name": "Phase 13G validation"
    },
    {
      "argv": [
        "{python}",
        "-m",
        "pytest",
        "-q",
        "tests/test_phase13g_readonly_validation_guardrails.py"
      ],
      "name": "Phase 13G tests"
    }
  ],
  "protected_actions": [
    "commit",
    "merge",
    "push"
  ],
  "runtime_noise_paths": [
    "workspace/factory_generated/upi_dispute_resolution/generation_runs/first_governed_generation_run_001/agent_runtime_ledgers/adapter_capability_ledger.jsonl",
    "workspace/factory_generated/upi_dispute_resolution/generation_runs/first_governed_generation_run_001/agent_runtime_ledgers/adapter_execution_ledger.jsonl",
    "workspace/factory_generated/upi_dispute_resolution/generation_runs/first_governed_generation_run_001/agent_runtime_ledgers/handoff_ledger.jsonl",
    "workspace/factory_generated/upi_dispute_resolution/generation_runs/first_governed_generation_run_001/agent_runtime_ledgers/runtime_event_ledger.jsonl",
    "workspace/factory_generated/upi_dispute_resolution/generation_runs/first_governed_generation_run_001/agent_runtime_ledgers/tool_execution_ledger.jsonl",
    "workspace/factory_generated/upi_dispute_resolution/lifecycle_artifacts/phase14u/autonomous_phase_discovery_and_planning_audit.json",
    "workspace/factory_generated/upi_dispute_resolution/lifecycle_artifacts/phase34/operator_portal_validation_run_report.json",
    "workspace/factory_generated/upi_dispute_resolution/lifecycle_artifacts/phase37/end_to_end_portal_run_flow_report.json"
  ],
  "schema_version": 1,
  "status": "DRAFT",
  "targeted_validation_commands": [
    {
      "argv": [
        "{python}",
        "-m",
        "pytest",
        "-q",
        "tests/autonomous_supervisor/test_phase46n_clean_slate_replay.py"
      ],
      "name": "Phase 46N harness tests"
    },
    {
      "argv": [
        "{python}",
        "scripts/run_phase46n_clean_slate_replay.py",
        "--project-root",
        "{worktree}"
      ],
      "name": "Phase 46N governed clean-slate replay"
    },
    {
      "argv": [
        "{python}",
        "-m",
        "ruff",
        "check",
        "tools/autonomous_supervisor/clean_slate.py",
        "scripts/run_phase46n_clean_slate_replay.py",
        "tests/autonomous_supervisor/test_phase46n_clean_slate_replay.py"
      ],
      "name": "Phase 46N Ruff"
    },
    {
      "argv": [
        "{python}",
        "-m",
        "mypy",
        "tools/autonomous_supervisor/clean_slate.py",
        "scripts/run_phase46n_clean_slate_replay.py",
        "tests/autonomous_supervisor/test_phase46n_clean_slate_replay.py"
      ],
      "name": "Phase 46N MyPy"
    }
  ]
}
