{
  "base_branch": "main",
  "candidate_paths": [
    "config/lifecycle/phases/phase46f.json"
  ],
  "commit_message": "feat(transformation): add bounded display identity migration",
  "feature_branch": "phase46f/contract-first-bounded-display-migration",
  "full_validation_commands": [],
  "implementation_commands": [],
  "llm": {
    "allowed_calls": 0,
    "enabled": false
  },
  "name": "Retired Phase 46F draft; see phase46f.json",
  "phase": "46F",
  "post_restore_validation_commands": [],
  "protected_actions": [],
  "runtime_noise_paths": [],
  "schema_version": 1,
  "status": "RETIRED",
  "targeted_validation_commands": []
}
